node,date,status,event,fact_or_prediction,wuxi_impact,wuxi_backlog_context,source
时点一 法案成法,2025-12-18,已发生,BIOSECURE 随 FY26 NDAA(Section 851)签署成法；不点名公司，改 1260H 机制；grandfather 分档(OMB-BCC 既有合同享 FAR 修订后约 5 年过渡；2025-12-18 已在 1260H 者不享 5 年，禁令 FAR 修订后 60 天生效),事实,签署当日药明未被列入受限名单，亦未落入"已列入者不豁免"档,(同期)药明康德 FY2025 持续经营 backlog 580 亿/+28.8%(2025 年末),L1;L2;LW
时点二 药明入 1260H,2026-06-08,已发生,DoD 更新 Section 1260H 中国军工企业清单(188 家)，药明康德被新增，同批含 BGI/MGI,事实,触发可能 BCC 认定但非即时禁用；进 1260H 即走"FAR 修订后 60 天"快档(非 5 年缓冲)，禁令最早或 2028 年中后期；药明回应认定"错误且毫无依据",backlog 仍处高位，业绩与政策风险并置,L3;L5;LW
时点三 OMB 发 BCC 名单,2026-12-18(截止前),尚未发生,OMB 须在该日前发布 BCC 正式名单,预测(高度不确定),名单落地+grandfather 收窄=风险提前实质化(本章证伪条件),—,L4
时点三 实施指引期,OMB 名单后约 180 天,尚未发生,BCC 名单发布后约 180 天实施指引,预测(高度不确定),过渡期，存量合同受 grandfather 保护,—,L4
时点三 FAR 修订,约一年,尚未发生,联邦采购条例(FAR)修订，全程或近三年才真正生效,预测(高度不确定),真正商业禁用此时方可能生效，截至 2026-06 未发生,替代产能短期难补,L4
