milestone,date,metric,value,coverage_dimension,source,note
三年行动计划发布,2021-11,政策目标,2024年底统筹地区全开展;2025年底医疗机构+病种+基金基本全覆盖,统筹地区/机构/病种/基金,S5,国家医保局DRG/DIP支付方式改革三年行动计划
截至2023年底进展,2023-12,开展DRG/DIP统筹地区占比,九成以上(190个DRG+192个DIP),统筹地区,S5/官方解读,26省份已实现省域内所有统筹地区全覆盖
DRG/DIP 2.0版发布,2024-07,分组方案版本,2.0版;DIP核心病种从11553组降到9520组,病种分组,S6,2024-07-23发布;已开展地区2024-12-31前完成切换准备工作;优化13个学科;研究创新药械DRG除外支付;9520为发布会实录精确值(已WebFetch核)
统筹地区全覆盖达成,2024年底(目标),实施付费的统筹地区,393个(DRG191+DIP200+天津上海并行),统筹地区,S7,三年计划2024底目标
最新覆盖进展,2025-05,病种覆盖率,约95%,病种,S7,快变量;引用须带时点
最新覆盖进展,2025-05,医保基金覆盖率,约80%,医保基金,S7,快变量;引用须带时点
机制设计,2024-07,机制反转,按项目付费→按病组打包付费;医院由收入中心变成本中心,激励机制,S6,医院主动压贵药/高值耗材/缩住院日/选性价比器械
